location_id,province_name,city_name,district_name,address_line1,postal_code
200000553,广东省,深圳市,南山区,广东省深圳市南山区文一西路658号,530732
200000554,上海市,上海市,浦东新区,上海市上海市浦东新区文一西路545号,265909
200000555,北京市,北京市,朝阳区,北京市北京市朝阳区人民路589号,408086
200000556,浙江省,杭州市,余杭区,浙江省杭州市余杭区张江路186号,205797
200000557,北京市,北京市,朝阳区,北京市北京市朝阳区人民路27号,565517
200000558,广东省,深圳市,福田区,广东省深圳市福田区高新南七道768号,432272
200000559,广东省,深圳市,宝安区,广东省深圳市宝安区人民路897号,594258
200000560,浙江省,杭州市,滨江区,浙江省杭州市滨江区星湖街179号,643791
200000561,广东省,深圳市,宝安区,广东省深圳市宝安区星湖街936号,527456
200000562,广东省,深圳市,福田区,广东省深圳市福田区创新大道481号,369338
200000563,浙江省,杭州市,滨江区,浙江省杭州市滨江区星湖街748号,791398
200000564,浙江省,杭州市,余杭区,浙江省杭州市余杭区人民路331号,112281
200000565,北京市,北京市,丰台区,北京市北京市丰台区创新大道680号,201191
200000566,上海市,上海市,浦东新区,上海市上海市浦东新区星湖街408号,959860
200000567,浙江省,杭州市,余杭区,浙江省杭州市余杭区星湖街651号,765124
200000568,江苏省,苏州市,吴中区,江苏省苏州市吴中区张江路214号,869089
200000569,北京市,北京市,朝阳区,北京市北京市朝阳区星湖街211号,564919
200000570,江苏省,苏州市,虎丘区,江苏省苏州市虎丘区科技南一道391号,978683
200000571,江苏省,苏州市,吴中区,江苏省苏州市吴中区张江路927号,363895
200000572,北京市,北京市,朝阳区,北京市北京市朝阳区文一西路605号,978922
200000573,北京市,北京市,丰台区,北京市北京市丰台区科技南一道222号,694469
200000574,江苏省,苏州市,工业园区,江苏省苏州市工业园区建国路572号,908251
200000575,北京市,北京市,丰台区,北京市北京市丰台区星湖街775号,501286
200000576,广东省,深圳市,南山区,广东省深圳市南山区文一西路93号,846235
200000577,浙江省,杭州市,西湖区,浙江省杭州市西湖区星湖街684号,387087
200000578,上海市,上海市,徐汇区,上海市上海市徐汇区人民路643号,703410
200000579,上海市,上海市,徐汇区,上海市上海市徐汇区创新大道549号,428712
200000580,北京市,北京市,丰台区,北京市北京市丰台区星湖街66号,815136
200000581,上海市,上海市,闵行区,上海市上海市闵行区星湖街785号,665824
200000582,江苏省,苏州市,工业园区,江苏省苏州市工业园区文一西路969号,523158
200000583,广东省,深圳市,福田区,广东省深圳市福田区创新大道770号,198595
200000584,上海市,上海市,闵行区,上海市上海市闵行区星湖街549号,328981
200000585,浙江省,杭州市,西湖区,浙江省杭州市西湖区星湖街922号,204565
200000586,北京市,北京市,丰台区,北京市北京市丰台区文一西路869号,645095
200000587,北京市,北京市,丰台区,北京市北京市丰台区人民路314号,621786
200000588,上海市,上海市,浦东新区,上海市上海市浦东新区人民路757号,633069
200000589,广东省,深圳市,福田区,广东省深圳市福田区科技南一道927号,352064
200000590,北京市,北京市,海淀区,北京市北京市海淀区人民路285号,983566
200000591,江苏省,苏州市,吴中区,江苏省苏州市吴中区人民路292号,662309
200000592,浙江省,杭州市,余杭区,浙江省杭州市余杭区文一西路248号,557125
200000593,广东省,深圳市,福田区,广东省深圳市福田区人民路157号,405980
200000594,广东省,深圳市,福田区,广东省深圳市福田区科技南一道634号,855480
200000595,北京市,北京市,丰台区,北京市北京市丰台区人民路290号,818914
200000596,广东省,深圳市,福田区,广东省深圳市福田区张江路148号,144622
200000597,北京市,北京市,朝阳区,北京市北京市朝阳区建国路252号,327498
200000598,江苏省,苏州市,吴中区,江苏省苏州市吴中区星湖街676号,502957
200000599,浙江省,杭州市,滨江区,浙江省杭州市滨江区高新南七道626号,900475
200000600,江苏省,苏州市,吴中区,江苏省苏州市吴中区创新大道487号,455069
200000601,广东省,深圳市,南山区,广东省深圳市南山区星湖街902号,499454
200000602,上海市,上海市,闵行区,上海市上海市闵行区人民路939号,256747
200000603,上海市,上海市,浦东新区,上海市上海市浦东新区创新大道327号,274988
200000604,北京市,北京市,海淀区,北京市北京市海淀区人民路37号,829062
200000605,广东省,深圳市,南山区,广东省深圳市南山区文一西路249号,178029
200000606,浙江省,杭州市,余杭区,浙江省杭州市余杭区文一西路191号,196158
200000607,广东省,深圳市,福田区,广东省深圳市福田区星湖街520号,106620
200000608,浙江省,杭州市,滨江区,浙江省杭州市滨江区张江路845号,461506
200000609,江苏省,苏州市,吴中区,江苏省苏州市吴中区文一西路583号,375185
200000610,北京市,北京市,海淀区,北京市北京市海淀区星湖街146号,873701
200000611,浙江省,杭州市,滨江区,浙江省杭州市滨江区高新南七道203号,122733
200000612,浙江省,杭州市,西湖区,浙江省杭州市西湖区创新大道823号,326915
200000613,江苏省,苏州市,虎丘区,江苏省苏州市虎丘区建国路215号,442046
200000614,北京市,北京市,朝阳区,北京市北京市朝阳区高新南七道524号,200225
200000615,广东省,深圳市,福田区,广东省深圳市福田区高新南七道845号,750801
200000616,北京市,北京市,丰台区,北京市北京市丰台区科技南一道306号,373665
200000617,北京市,北京市,海淀区,北京市北京市海淀区星湖街601号,234779
200000618,广东省,深圳市,宝安区,广东省深圳市宝安区科技南一道741号,852112
200000619,北京市,北京市,丰台区,北京市北京市丰台区人民路712号,262512
200000620,浙江省,杭州市,西湖区,浙江省杭州市西湖区高新南七道331号,506349
200000621,上海市,上海市,浦东新区,上海市上海市浦东新区人民路218号,259651
200000622,北京市,北京市,丰台区,北京市北京市丰台区人民路210号,293810
200000623,江苏省,苏州市,工业园区,江苏省苏州市工业园区建国路850号,289707
200000624,广东省,深圳市,福田区,广东省深圳市福田区科技南一道311号,566679
200000625,浙江省,杭州市,余杭区,浙江省杭州市余杭区科技南一道902号,599651
200000626,北京市,北京市,海淀区,北京市北京市海淀区星湖街997号,113913
200000627,北京市,北京市,朝阳区,北京市北京市朝阳区科技南一道294号,481718
200000628,北京市,北京市,丰台区,北京市北京市丰台区人民路369号,552682
200000629,北京市,北京市,朝阳区,北京市北京市朝阳区人民路902号,217314
200000630,北京市,北京市,丰台区,北京市北京市丰台区文一西路232号,771580
200000631,广东省,深圳市,福田区,广东省深圳市福田区文一西路213号,294735
200000632,北京市,北京市,朝阳区,北京市北京市朝阳区创新大道328号,468571
200000633,浙江省,杭州市,西湖区,浙江省杭州市西湖区文一西路466号,498302
200000634,北京市,北京市,海淀区,北京市北京市海淀区人民路821号,661683
200000635,北京市,北京市,丰台区,北京市北京市丰台区星湖街792号,495019
200000636,上海市,上海市,徐汇区,上海市上海市徐汇区高新南七道651号,669884
200000637,浙江省,杭州市,西湖区,浙江省杭州市西湖区建国路457号,791915
200000638,江苏省,苏州市,吴中区,江苏省苏州市吴中区科技南一道311号,950879
200000639,广东省,深圳市,福田区,广东省深圳市福田区文一西路580号,272734
200000640,上海市,上海市,闵行区,上海市上海市闵行区星湖街248号,728074
200000641,江苏省,苏州市,虎丘区,江苏省苏州市虎丘区创新大道396号,894210
200000642,江苏省,苏州市,工业园区,江苏省苏州市工业园区建国路357号,421228
200000643,上海市,上海市,徐汇区,上海市上海市徐汇区星湖街121号,859790
200000644,北京市,北京市,丰台区,北京市北京市丰台区人民路4号,169778
200000645,广东省,深圳市,南山区,广东省深圳市南山区文一西路285号,212681
200000646,江苏省,苏州市,吴中区,江苏省苏州市吴中区高新南七道861号,347843
200000647,北京市,北京市,朝阳区,北京市北京市朝阳区建国路471号,739219
200000648,北京市,北京市,丰台区,北京市北京市丰台区人民路24号,667557
200000649,北京市,北京市,朝阳区,北京市北京市朝阳区人民路213号,328514
200000650,北京市,北京市,海淀区,北京市北京市海淀区创新大道932号,544740
200000651,浙江省,杭州市,余杭区,浙江省杭州市余杭区星湖街95号,745346
200000652,浙江省,杭州市,滨江区,浙江省杭州市滨江区创新大道965号,543824
200000653,江苏省,苏州市,吴中区,江苏省苏州市吴中区科技南一道513号,629016
200000654,广东省,深圳市,福田区,广东省深圳市福田区星湖街1号,401153
200000655,浙江省,杭州市,余杭区,浙江省杭州市余杭区建国路76号,728934
200000656,广东省,深圳市,南山区,广东省深圳市南山区创新大道259号,610421
200000657,上海市,上海市,闵行区,上海市上海市闵行区科技南一道957号,988326
200000658,上海市,上海市,闵行区,上海市上海市闵行区高新南七道637号,442406
200000659,江苏省,苏州市,工业园区,江苏省苏州市工业园区星湖街781号,305871
200000660,浙江省,杭州市,余杭区,浙江省杭州市余杭区张江路745号,606110
200000661,上海市,上海市,徐汇区,上海市上海市徐汇区张江路826号,722697
200000662,浙江省,杭州市,滨江区,浙江省杭州市滨江区星湖街949号,203386
200000663,北京市,北京市,朝阳区,北京市北京市朝阳区高新南七道961号,488371
200000664,广东省,深圳市,南山区,广东省深圳市南山区人民路505号,196799
200000665,广东省,深圳市,宝安区,广东省深圳市宝安区科技南一道842号,301586
200000666,江苏省,苏州市,工业园区,江苏省苏州市工业园区人民路873号,455108
200000667,广东省,深圳市,南山区,广东省深圳市南山区科技南一道602号,223436
200000668,北京市,北京市,朝阳区,北京市北京市朝阳区高新南七道68号,151288
200000669,北京市,北京市,朝阳区,北京市北京市朝阳区创新大道897号,450807
200000670,浙江省,杭州市,滨江区,浙江省杭州市滨江区张江路544号,509668
200000671,北京市,北京市,海淀区,北京市北京市海淀区建国路946号,430489
200000672,广东省,深圳市,福田区,广东省深圳市福田区人民路17号,626124
200000673,浙江省,杭州市,余杭区,浙江省杭州市余杭区人民路82号,444745
200000674,广东省,深圳市,南山区,广东省深圳市南山区建国路68号,916489
200000675,上海市,上海市,闵行区,上海市上海市闵行区科技南一道933号,750475
200000676,北京市,北京市,丰台区,北京市北京市丰台区文一西路763号,337765
200000677,北京市,北京市,朝阳区,北京市北京市朝阳区星湖街864号,200639
200000678,江苏省,苏州市,吴中区,江苏省苏州市吴中区星湖街713号,370827
200000679,江苏省,苏州市,虎丘区,江苏省苏州市虎丘区高新南七道910号,229737
200000680,广东省,深圳市,福田区,广东省深圳市福田区人民路96号,789855
200000681,浙江省,杭州市,西湖区,浙江省杭州市西湖区文一西路646号,951703
200000682,上海市,上海市,徐汇区,上海市上海市徐汇区人民路198号,965101
200000683,上海市,上海市,浦东新区,上海市上海市浦东新区建国路136号,845609
200000684,浙江省,杭州市,余杭区,浙江省杭州市余杭区文一西路890号,486669
200000685,北京市,北京市,朝阳区,北京市北京市朝阳区科技南一道801号,974187
200000686,江苏省,苏州市,虎丘区,江苏省苏州市虎丘区人民路277号,268252
200000687,上海市,上海市,闵行区,上海市上海市闵行区人民路21号,166026
200000688,上海市,上海市,闵行区,上海市上海市闵行区高新南七道2号,604385
200000689,浙江省,杭州市,滨江区,浙江省杭州市滨江区科技南一道879号,452476
200000690,广东省,深圳市,南山区,广东省深圳市南山区创新大道736号,242314
200000691,上海市,上海市,徐汇区,上海市上海市徐汇区建国路46号,599135
200000692,浙江省,杭州市,余杭区,浙江省杭州市余杭区文一西路643号,699475
200000693,浙江省,杭州市,滨江区,浙江省杭州市滨江区张江路855号,820119
200000694,浙江省,杭州市,滨江区,浙江省杭州市滨江区高新南七道908号,575062
200000695,广东省,深圳市,宝安区,广东省深圳市宝安区星湖街923号,156405
200000696,广东省,深圳市,福田区,广东省深圳市福田区文一西路266号,373825
200000697,江苏省,苏州市,虎丘区,江苏省苏州市虎丘区科技南一道34号,902663
200000698,浙江省,杭州市,滨江区,浙江省杭州市滨江区高新南七道389号,804830
200000699,广东省,深圳市,福田区,广东省深圳市福田区人民路481号,142344
200000700,江苏省,苏州市,吴中区,江苏省苏州市吴中区建国路330号,487518
200000701,上海市,上海市,浦东新区,上海市上海市浦东新区星湖街67号,163660
200000702,浙江省,杭州市,西湖区,浙江省杭州市西湖区文一西路145号,830484
200000703,广东省,深圳市,福田区,广东省深圳市福田区张江路969号,762314
200000704,江苏省,苏州市,虎丘区,江苏省苏州市虎丘区张江路884号,404716
200000705,广东省,深圳市,福田区,广东省深圳市福田区建国路210号,326632
200000706,浙江省,杭州市,西湖区,浙江省杭州市西湖区文一西路647号,811755
200000707,北京市,北京市,丰台区,北京市北京市丰台区科技南一道11号,293807
200000708,北京市,北京市,朝阳区,北京市北京市朝阳区建国路402号,485776
200000709,北京市,北京市,朝阳区,北京市北京市朝阳区星湖街835号,858072
200000710,江苏省,苏州市,工业园区,江苏省苏州市工业园区创新大道959号,514708
200000711,北京市,北京市,朝阳区,北京市北京市朝阳区高新南七道963号,881358
200000712,江苏省,苏州市,吴中区,江苏省苏州市吴中区科技南一道119号,353860
200000713,广东省,深圳市,宝安区,广东省深圳市宝安区高新南七道463号,824679
200000714,北京市,北京市,丰台区,北京市北京市丰台区张江路851号,679546
200000715,上海市,上海市,闵行区,上海市上海市闵行区建国路977号,283630
200000716,广东省,深圳市,宝安区,广东省深圳市宝安区创新大道179号,885673
200000717,广东省,深圳市,南山区,广东省深圳市南山区人民路350号,131394
200000718,浙江省,杭州市,余杭区,浙江省杭州市余杭区高新南七道586号,453215
200000719,上海市,上海市,闵行区,上海市上海市闵行区人民路930号,508196
200000720,江苏省,苏州市,工业园区,江苏省苏州市工业园区创新大道418号,911235
200000721,北京市,北京市,海淀区,北京市北京市海淀区星湖街611号,243857
200000722,浙江省,杭州市,余杭区,浙江省杭州市余杭区创新大道238号,193519
200000723,浙江省,杭州市,滨江区,浙江省杭州市滨江区建国路845号,638228
200000724,北京市,北京市,海淀区,北京市北京市海淀区科技南一道997号,957170
200000725,广东省,深圳市,福田区,广东省深圳市福田区星湖街105号,758784
200000726,江苏省,苏州市,虎丘区,江苏省苏州市虎丘区科技南一道347号,340027
200000727,北京市,北京市,丰台区,北京市北京市丰台区星湖街87号,790917
200000728,浙江省,杭州市,余杭区,浙江省杭州市余杭区星湖街336号,695451
200000729,浙江省,杭州市,西湖区,浙江省杭州市西湖区人民路999号,854124
200000730,北京市,北京市,朝阳区,北京市北京市朝阳区高新南七道946号,287739
200000731,北京市,北京市,丰台区,北京市北京市丰台区星湖街878号,753935
200000732,江苏省,苏州市,虎丘区,江苏省苏州市虎丘区人民路746号,749633
200000733,上海市,上海市,闵行区,上海市上海市闵行区星湖街654号,358604
200000734,江苏省,苏州市,虎丘区,江苏省苏州市虎丘区星湖街992号,703396
200000735,北京市,北京市,丰台区,北京市北京市丰台区张江路845号,374419
200000736,江苏省,苏州市,工业园区,江苏省苏州市工业园区高新南七道301号,575714
200000737,上海市,上海市,闵行区,上海市上海市闵行区星湖街714号,774561
200000738,江苏省,苏州市,工业园区,江苏省苏州市工业园区建国路865号,639236
200000739,浙江省,杭州市,余杭区,浙江省杭州市余杭区创新大道724号,454303
200000740,北京市,北京市,海淀区,北京市北京市海淀区科技南一道140号,992351
200000741,北京市,北京市,朝阳区,北京市北京市朝阳区建国路649号,763753
200000742,江苏省,苏州市,吴中区,江苏省苏州市吴中区人民路154号,883181
200000743,广东省,深圳市,宝安区,广东省深圳市宝安区张江路640号,197102
200000744,北京市,北京市,海淀区,北京市北京市海淀区高新南七道267号,883104
200000745,浙江省,杭州市,西湖区,浙江省杭州市西湖区创新大道984号,226804
200000746,广东省,深圳市,宝安区,广东省深圳市宝安区人民路819号,442836
200000747,北京市,北京市,丰台区,北京市北京市丰台区创新大道225号,269409
200000748,广东省,深圳市,福田区,广东省深圳市福田区建国路683号,724842
200000749,广东省,深圳市,宝安区,广东省深圳市宝安区建国路178号,139486
200000750,浙江省,杭州市,滨江区,浙江省杭州市滨江区文一西路835号,700483
200000751,浙江省,杭州市,滨江区,浙江省杭州市滨江区张江路670号,870621
200000752,北京市,北京市,海淀区,北京市北京市海淀区创新大道771号,792251
200000753,上海市,上海市,徐汇区,上海市上海市徐汇区建国路38号,407874
200000754,江苏省,苏州市,工业园区,江苏省苏州市工业园区高新南七道138号,257420
200000755,上海市,上海市,闵行区,上海市上海市闵行区科技南一道795号,201888
200000756,北京市,北京市,朝阳区,北京市北京市朝阳区人民路127号,479398
200000757,广东省,深圳市,福田区,广东省深圳市福田区高新南七道268号,266302
200000758,江苏省,苏州市,虎丘区,江苏省苏州市虎丘区高新南七道381号,398889
200000759,北京市,北京市,丰台区,北京市北京市丰台区建国路103号,571152
200000760,北京市,北京市,朝阳区,北京市北京市朝阳区建国路521号,144512
200000761,北京市,北京市,朝阳区,北京市北京市朝阳区高新南七道545号,653776
200000762,北京市,北京市,朝阳区,北京市北京市朝阳区文一西路362号,713571
200000763,北京市,北京市,朝阳区,北京市北京市朝阳区张江路39号,120602
200000764,北京市,北京市,丰台区,北京市北京市丰台区创新大道655号,334546
200000765,江苏省,苏州市,工业园区,江苏省苏州市工业园区建国路851号,282657
200000766,上海市,上海市,浦东新区,上海市上海市浦东新区文一西路92号,530694
200000767,上海市,上海市,徐汇区,上海市上海市徐汇区张江路951号,793618
200000768,江苏省,苏州市,吴中区,江苏省苏州市吴中区科技南一道429号,597347
200000769,上海市,上海市,徐汇区,上海市上海市徐汇区星湖街475号,861481
200000770,浙江省,杭州市,余杭区,浙江省杭州市余杭区创新大道291号,806942
200000771,江苏省,苏州市,吴中区,江苏省苏州市吴中区人民路27号,378548
200000772,上海市,上海市,浦东新区,上海市上海市浦东新区张江路548号,519567
200000773,广东省,深圳市,宝安区,广东省深圳市宝安区建国路367号,793298
200000774,广东省,深圳市,南山区,广东省深圳市南山区高新南七道929号,391941
200000775,浙江省,杭州市,西湖区,浙江省杭州市西湖区张江路609号,664385
200000776,江苏省,苏州市,吴中区,江苏省苏州市吴中区人民路632号,795381
200000777,上海市,上海市,徐汇区,上海市上海市徐汇区星湖街60号,985856
200000778,浙江省,杭州市,余杭区,浙江省杭州市余杭区张江路336号,490477
200000779,上海市,上海市,徐汇区,上海市上海市徐汇区人民路442号,621670
200000780,浙江省,杭州市,西湖区,浙江省杭州市西湖区科技南一道436号,237212
200000781,北京市,北京市,朝阳区,北京市北京市朝阳区星湖街122号,283404
200000782,上海市,上海市,闵行区,上海市上海市闵行区人民路62号,106416
200000783,北京市,北京市,海淀区,北京市北京市海淀区星湖街654号,951432
200000784,浙江省,杭州市,滨江区,浙江省杭州市滨江区张江路971号,639026
200000785,浙江省,杭州市,余杭区,浙江省杭州市余杭区创新大道293号,907142
200000786,北京市,北京市,海淀区,北京市北京市海淀区科技南一道671号,669273
200000787,江苏省,苏州市,工业园区,江苏省苏州市工业园区张江路13号,137501
200000788,江苏省,苏州市,虎丘区,江苏省苏州市虎丘区张江路438号,156085
200000789,上海市,上海市,徐汇区,上海市上海市徐汇区张江路896号,665042
200000790,广东省,深圳市,宝安区,广东省深圳市宝安区人民路728号,364905
200000791,上海市,上海市,浦东新区,上海市上海市浦东新区建国路172号,252783
200000792,上海市,上海市,徐汇区,上海市上海市徐汇区创新大道733号,504995
200000793,上海市,上海市,徐汇区,上海市上海市徐汇区星湖街200号,430156
200000794,广东省,深圳市,福田区,广东省深圳市福田区人民路996号,800912
200000795,上海市,上海市,徐汇区,上海市上海市徐汇区科技南一道377号,910555
200000796,上海市,上海市,徐汇区,上海市上海市徐汇区文一西路484号,654842
200000797,江苏省,苏州市,虎丘区,江苏省苏州市虎丘区星湖街390号,115406
200000798,浙江省,杭州市,余杭区,浙江省杭州市余杭区文一西路555号,805664
200000799,浙江省,杭州市,余杭区,浙江省杭州市余杭区高新南七道698号,407912
200000800,浙江省,杭州市,西湖区,浙江省杭州市西湖区高新南七道420号,388472
200000801,浙江省,杭州市,余杭区,浙江省杭州市余杭区星湖街430号,176009
200000802,广东省,深圳市,宝安区,广东省深圳市宝安区科技南一道762号,480347
200000803,江苏省,苏州市,工业园区,江苏省苏州市工业园区星湖街817号,695053
200000804,上海市,上海市,浦东新区,上海市上海市浦东新区建国路924号,907940
200000805,浙江省,杭州市,滨江区,浙江省杭州市滨江区星湖街431号,655682
200000806,江苏省,苏州市,虎丘区,江苏省苏州市虎丘区星湖街554号,149736
200000807,江苏省,苏州市,虎丘区,江苏省苏州市虎丘区文一西路44号,617351
200000808,浙江省,杭州市,余杭区,浙江省杭州市余杭区科技南一道416号,851919
200000809,广东省,深圳市,南山区,广东省深圳市南山区高新南七道114号,453643
200000810,江苏省,苏州市,吴中区,江苏省苏州市吴中区高新南七道660号,129412
200000811,北京市,北京市,朝阳区,北京市北京市朝阳区张江路66号,175506
200000812,广东省,深圳市,福田区,广东省深圳市福田区人民路966号,964286
200000813,江苏省,苏州市,工业园区,江苏省苏州市工业园区科技南一道3号,511702
200000814,江苏省,苏州市,工业园区,江苏省苏州市工业园区科技南一道643号,295842
200000815,上海市,上海市,徐汇区,上海市上海市徐汇区人民路523号,365580
200000816,浙江省,杭州市,余杭区,浙江省杭州市余杭区星湖街608号,872744
200000817,北京市,北京市,朝阳区,北京市北京市朝阳区星湖街2号,566529
200000818,上海市,上海市,浦东新区,上海市上海市浦东新区人民路109号,910342
200000819,江苏省,苏州市,工业园区,江苏省苏州市工业园区创新大道548号,902777
200000820,北京市,北京市,朝阳区,北京市北京市朝阳区科技南一道56号,286260
200000821,江苏省,苏州市,吴中区,江苏省苏州市吴中区建国路718号,110703
200000822,广东省,深圳市,南山区,广东省深圳市南山区文一西路428号,451760
200000823,浙江省,杭州市,西湖区,浙江省杭州市西湖区文一西路426号,815795
200000824,浙江省,杭州市,余杭区,浙江省杭州市余杭区文一西路821号,312886
200000825,北京市,北京市,海淀区,北京市北京市海淀区高新南七道62号,417924
200000826,上海市,上海市,闵行区,上海市上海市闵行区星湖街465号,298991
200000827,上海市,上海市,徐汇区,上海市上海市徐汇区科技南一道547号,870653
200000828,江苏省,苏州市,虎丘区,江苏省苏州市虎丘区星湖街911号,483394
200000829,江苏省,苏州市,虎丘区,江苏省苏州市虎丘区创新大道798号,863116
