location_id,province_name,city_name,district_name,address_line1,postal_code
200000830,江苏省,苏州市,虎丘区,江苏省苏州市虎丘区人民路954号,863503
200000831,北京市,北京市,丰台区,北京市北京市丰台区星湖街331号,924733
200000832,江苏省,苏州市,工业园区,江苏省苏州市工业园区张江路667号,670909
200000833,江苏省,苏州市,工业园区,江苏省苏州市工业园区星湖街955号,226088
200000834,浙江省,杭州市,西湖区,浙江省杭州市西湖区星湖街891号,779587
200000835,江苏省,苏州市,工业园区,江苏省苏州市工业园区科技南一道948号,900264
200000836,北京市,北京市,丰台区,北京市北京市丰台区建国路123号,546087
200000837,浙江省,杭州市,西湖区,浙江省杭州市西湖区科技南一道616号,776200
200000838,浙江省,杭州市,余杭区,浙江省杭州市余杭区张江路373号,994292
200000839,上海市,上海市,闵行区,上海市上海市闵行区文一西路783号,630229
200000840,北京市,北京市,丰台区,北京市北京市丰台区人民路946号,841816
200000841,江苏省,苏州市,虎丘区,江苏省苏州市虎丘区星湖街355号,687426
200000842,浙江省,杭州市,余杭区,浙江省杭州市余杭区文一西路545号,158114
200000843,北京市,北京市,朝阳区,北京市北京市朝阳区人民路677号,160116
200000844,江苏省,苏州市,工业园区,江苏省苏州市工业园区文一西路580号,903657
200000845,浙江省,杭州市,滨江区,浙江省杭州市滨江区星湖街683号,115633
200000846,北京市,北京市,海淀区,北京市北京市海淀区科技南一道580号,648635
200000847,浙江省,杭州市,西湖区,浙江省杭州市西湖区建国路964号,761614
200000848,广东省,深圳市,宝安区,广东省深圳市宝安区文一西路361号,983073
200000849,上海市,上海市,闵行区,上海市上海市闵行区创新大道946号,424544
200000850,江苏省,苏州市,吴中区,江苏省苏州市吴中区人民路632号,295529
200000851,北京市,北京市,丰台区,北京市北京市丰台区建国路437号,414268
200000852,江苏省,苏州市,吴中区,江苏省苏州市吴中区文一西路406号,697043
200000853,江苏省,苏州市,吴中区,江苏省苏州市吴中区人民路132号,734848
200000854,上海市,上海市,闵行区,上海市上海市闵行区建国路294号,760914
200000855,江苏省,苏州市,工业园区,江苏省苏州市工业园区星湖街798号,220375
200000856,广东省,深圳市,福田区,广东省深圳市福田区高新南七道566号,412837
200000857,浙江省,杭州市,滨江区,浙江省杭州市滨江区创新大道300号,292006
200000858,上海市,上海市,浦东新区,上海市上海市浦东新区星湖街908号,943807
200000859,浙江省,杭州市,滨江区,浙江省杭州市滨江区高新南七道748号,890512
200000860,广东省,深圳市,宝安区,广东省深圳市宝安区文一西路687号,548555
200000861,浙江省,杭州市,余杭区,浙江省杭州市余杭区张江路836号,611323
200000862,江苏省,苏州市,工业园区,江苏省苏州市工业园区创新大道834号,857294
200000863,上海市,上海市,浦东新区,上海市上海市浦东新区创新大道158号,926927
200000864,浙江省,杭州市,滨江区,浙江省杭州市滨江区文一西路814号,295356
200000865,浙江省,杭州市,西湖区,浙江省杭州市西湖区星湖街361号,208599
200000866,江苏省,苏州市,虎丘区,江苏省苏州市虎丘区星湖街148号,218475
200000867,上海市,上海市,闵行区,上海市上海市闵行区高新南七道13号,384124
200000868,上海市,上海市,徐汇区,上海市上海市徐汇区高新南七道425号,344497
200000869,上海市,上海市,徐汇区,上海市上海市徐汇区星湖街155号,721311
200000870,浙江省,杭州市,余杭区,浙江省杭州市余杭区人民路387号,179689
200000871,浙江省,杭州市,余杭区,浙江省杭州市余杭区星湖街801号,179974
200000872,广东省,深圳市,福田区,广东省深圳市福田区张江路313号,886512
200000873,广东省,深圳市,宝安区,广东省深圳市宝安区人民路742号,235582
200000874,北京市,北京市,丰台区,北京市北京市丰台区文一西路93号,593941
200000875,浙江省,杭州市,西湖区,浙江省杭州市西湖区星湖街553号,453014
200000876,上海市,上海市,徐汇区,上海市上海市徐汇区科技南一道62号,573014
200000877,广东省,深圳市,宝安区,广东省深圳市宝安区高新南七道651号,219584
200000878,浙江省,杭州市,余杭区,浙江省杭州市余杭区建国路358号,295910
200000879,上海市,上海市,徐汇区,上海市上海市徐汇区文一西路877号,785967
200000880,浙江省,杭州市,西湖区,浙江省杭州市西湖区科技南一道734号,961833
200000881,上海市,上海市,闵行区,上海市上海市闵行区人民路644号,767378
200000882,广东省,深圳市,宝安区,广东省深圳市宝安区创新大道315号,819324
200000883,上海市,上海市,徐汇区,上海市上海市徐汇区文一西路390号,407198
200000884,北京市,北京市,朝阳区,北京市北京市朝阳区人民路410号,403959
200000885,上海市,上海市,徐汇区,上海市上海市徐汇区建国路634号,723907
200000886,北京市,北京市,朝阳区,北京市北京市朝阳区高新南七道661号,313181
200000887,广东省,深圳市,南山区,广东省深圳市南山区文一西路647号,886558
200000888,北京市,北京市,海淀区,北京市北京市海淀区星湖街309号,140495
200000889,江苏省,苏州市,虎丘区,江苏省苏州市虎丘区科技南一道265号,623138
200000890,江苏省,苏州市,虎丘区,江苏省苏州市虎丘区高新南七道224号,206564
200000891,江苏省,苏州市,吴中区,江苏省苏州市吴中区建国路633号,463336
200000892,北京市,北京市,朝阳区,北京市北京市朝阳区科技南一道345号,154762
200000893,上海市,上海市,闵行区,上海市上海市闵行区创新大道205号,372585
200000894,上海市,上海市,闵行区,上海市上海市闵行区星湖街832号,683864
200000895,上海市,上海市,浦东新区,上海市上海市浦东新区文一西路525号,691947
200000896,北京市,北京市,朝阳区,北京市北京市朝阳区张江路910号,494338
200000897,北京市,北京市,丰台区,北京市北京市丰台区张江路927号,401454
200000898,上海市,上海市,浦东新区,上海市上海市浦东新区星湖街147号,174928
200000899,江苏省,苏州市,工业园区,江苏省苏州市工业园区人民路509号,897493
200000900,北京市,北京市,丰台区,北京市北京市丰台区文一西路282号,452908
200000901,上海市,上海市,浦东新区,上海市上海市浦东新区创新大道985号,885385
200000902,江苏省,苏州市,虎丘区,江苏省苏州市虎丘区文一西路250号,858652
200000903,上海市,上海市,闵行区,上海市上海市闵行区建国路389号,894323
200000904,江苏省,苏州市,虎丘区,江苏省苏州市虎丘区建国路89号,782268
200000905,广东省,深圳市,南山区,广东省深圳市南山区人民路785号,781738
200000906,江苏省,苏州市,虎丘区,江苏省苏州市虎丘区张江路44号,491438
200000907,上海市,上海市,浦东新区,上海市上海市浦东新区高新南七道814号,321684
200000908,江苏省,苏州市,工业园区,江苏省苏州市工业园区建国路852号,971820
200000909,浙江省,杭州市,西湖区,浙江省杭州市西湖区文一西路520号,617385
200000910,江苏省,苏州市,工业园区,江苏省苏州市工业园区人民路993号,124318
200000911,江苏省,苏州市,工业园区,江苏省苏州市工业园区科技南一道58号,841632
200000912,广东省,深圳市,宝安区,广东省深圳市宝安区创新大道155号,880569
200000913,上海市,上海市,浦东新区,上海市上海市浦东新区科技南一道198号,420317
200000914,北京市,北京市,丰台区,北京市北京市丰台区星湖街72号,698989
200000915,北京市,北京市,朝阳区,北京市北京市朝阳区建国路771号,916518
200000916,江苏省,苏州市,吴中区,江苏省苏州市吴中区人民路812号,217309
200000917,北京市,北京市,朝阳区,北京市北京市朝阳区星湖街351号,289880
200000918,浙江省,杭州市,滨江区,浙江省杭州市滨江区人民路81号,783195
200000919,上海市,上海市,闵行区,上海市上海市闵行区张江路751号,736118
200000920,浙江省,杭州市,滨江区,浙江省杭州市滨江区文一西路579号,214856
200000921,江苏省,苏州市,吴中区,江苏省苏州市吴中区人民路277号,570860
200000922,广东省,深圳市,南山区,广东省深圳市南山区建国路3号,163920
200000923,广东省,深圳市,南山区,广东省深圳市南山区文一西路394号,695294
200000924,上海市,上海市,浦东新区,上海市上海市浦东新区人民路492号,370546
200000925,江苏省,苏州市,吴中区,江苏省苏州市吴中区张江路338号,625597
200000926,江苏省,苏州市,虎丘区,江苏省苏州市虎丘区张江路884号,524067
200000927,江苏省,苏州市,工业园区,江苏省苏州市工业园区星湖街985号,510079
200000928,广东省,深圳市,南山区,广东省深圳市南山区文一西路791号,687216
200000929,广东省,深圳市,福田区,广东省深圳市福田区人民路419号,124674
200000930,江苏省,苏州市,工业园区,江苏省苏州市工业园区创新大道754号,550240
200000931,江苏省,苏州市,工业园区,江苏省苏州市工业园区科技南一道375号,623470
200000932,浙江省,杭州市,滨江区,浙江省杭州市滨江区创新大道4号,634131
200000933,北京市,北京市,朝阳区,北京市北京市朝阳区星湖街593号,163008
200000934,北京市,北京市,丰台区,北京市北京市丰台区星湖街971号,215828
200000935,上海市,上海市,闵行区,上海市上海市闵行区建国路560号,677168
200000936,上海市,上海市,浦东新区,上海市上海市浦东新区人民路415号,372284
200000937,上海市,上海市,闵行区,上海市上海市闵行区科技南一道844号,351361
200000938,广东省,深圳市,南山区,广东省深圳市南山区张江路942号,597909
200000939,上海市,上海市,徐汇区,上海市上海市徐汇区张江路866号,767033
200000940,北京市,北京市,朝阳区,北京市北京市朝阳区创新大道614号,897392
200000941,广东省,深圳市,宝安区,广东省深圳市宝安区建国路497号,455307
200000942,浙江省,杭州市,余杭区,浙江省杭州市余杭区人民路988号,295268
200000943,江苏省,苏州市,吴中区,江苏省苏州市吴中区星湖街92号,437488
200000944,浙江省,杭州市,西湖区,浙江省杭州市西湖区星湖街296号,668149
200000945,江苏省,苏州市,吴中区,江苏省苏州市吴中区人民路716号,404927
200000946,上海市,上海市,闵行区,上海市上海市闵行区文一西路328号,595408
200000947,浙江省,杭州市,滨江区,浙江省杭州市滨江区科技南一道781号,804062
200000948,北京市,北京市,朝阳区,北京市北京市朝阳区科技南一道847号,624330
200000949,广东省,深圳市,福田区,广东省深圳市福田区高新南七道723号,581316
200000950,广东省,深圳市,福田区,广东省深圳市福田区人民路700号,316923
200000951,广东省,深圳市,福田区,广东省深圳市福田区人民路606号,812427
200000952,广东省,深圳市,福田区,广东省深圳市福田区建国路699号,788115
200000953,北京市,北京市,丰台区,北京市北京市丰台区星湖街467号,864037
200000954,江苏省,苏州市,工业园区,江苏省苏州市工业园区高新南七道117号,402986
200000955,江苏省,苏州市,工业园区,江苏省苏州市工业园区人民路276号,619522
200000956,浙江省,杭州市,滨江区,浙江省杭州市滨江区创新大道188号,366134
200000957,上海市,上海市,徐汇区,上海市上海市徐汇区高新南七道112号,832829
200000958,北京市,北京市,丰台区,北京市北京市丰台区人民路464号,514326
200000959,北京市,北京市,丰台区,北京市北京市丰台区创新大道373号,890141
200000960,上海市,上海市,浦东新区,上海市上海市浦东新区建国路178号,264497
200000961,广东省,深圳市,南山区,广东省深圳市南山区人民路595号,628790
200000962,上海市,上海市,徐汇区,上海市上海市徐汇区建国路126号,232461
200000963,北京市,北京市,海淀区,北京市北京市海淀区高新南七道285号,267827
200000964,北京市,北京市,朝阳区,北京市北京市朝阳区人民路876号,387382
200000965,浙江省,杭州市,滨江区,浙江省杭州市滨江区科技南一道196号,274289
200000966,北京市,北京市,丰台区,北京市北京市丰台区星湖街268号,588780
200000967,北京市,北京市,海淀区,北京市北京市海淀区科技南一道442号,616643
200000968,北京市,北京市,海淀区,北京市北京市海淀区科技南一道905号,645013
200000969,上海市,上海市,浦东新区,上海市上海市浦东新区高新南七道313号,327233
200000970,上海市,上海市,闵行区,上海市上海市闵行区建国路604号,897420
200000971,北京市,北京市,海淀区,北京市北京市海淀区科技南一道269号,971412
200000972,浙江省,杭州市,余杭区,浙江省杭州市余杭区张江路857号,586204
200000973,北京市,北京市,海淀区,北京市北京市海淀区建国路726号,651259
200000974,上海市,上海市,闵行区,上海市上海市闵行区张江路730号,197678
200000975,浙江省,杭州市,滨江区,浙江省杭州市滨江区张江路185号,753971
200000976,广东省,深圳市,南山区,广东省深圳市南山区张江路574号,329840
200000977,江苏省,苏州市,吴中区,江苏省苏州市吴中区高新南七道764号,336343
200000978,江苏省,苏州市,工业园区,江苏省苏州市工业园区文一西路401号,861384
200000979,上海市,上海市,闵行区,上海市上海市闵行区张江路218号,579237
200000980,上海市,上海市,徐汇区,上海市上海市徐汇区科技南一道961号,162715
200000981,广东省,深圳市,南山区,广东省深圳市南山区建国路455号,379979
200000982,北京市,北京市,丰台区,北京市北京市丰台区张江路795号,185230
200000983,江苏省,苏州市,吴中区,江苏省苏州市吴中区高新南七道869号,122971
200000984,浙江省,杭州市,余杭区,浙江省杭州市余杭区文一西路412号,900069
200000985,江苏省,苏州市,工业园区,江苏省苏州市工业园区建国路475号,194830
200000986,上海市,上海市,徐汇区,上海市上海市徐汇区科技南一道116号,395988
200000987,上海市,上海市,徐汇区,上海市上海市徐汇区张江路675号,924547
200000988,江苏省,苏州市,吴中区,江苏省苏州市吴中区星湖街923号,991207
200000989,广东省,深圳市,福田区,广东省深圳市福田区星湖街412号,257519
200000990,广东省,深圳市,南山区,广东省深圳市南山区人民路553号,102288
200000991,北京市,北京市,朝阳区,北京市北京市朝阳区张江路288号,382406
200000992,上海市,上海市,浦东新区,上海市上海市浦东新区文一西路962号,263798
200000993,江苏省,苏州市,工业园区,江苏省苏州市工业园区高新南七道364号,333104
200000994,江苏省,苏州市,虎丘区,江苏省苏州市虎丘区人民路421号,259666
200000995,江苏省,苏州市,工业园区,江苏省苏州市工业园区人民路189号,273838
200000996,上海市,上海市,徐汇区,上海市上海市徐汇区创新大道886号,519238
200000997,上海市,上海市,徐汇区,上海市上海市徐汇区建国路783号,728611
200000998,上海市,上海市,浦东新区,上海市上海市浦东新区建国路308号,223950
200000999,广东省,深圳市,福田区,广东省深圳市福田区星湖街57号,643781
200001000,浙江省,杭州市,余杭区,浙江省杭州市余杭区文一西路486号,790887
