location_id,province_name,city_name,district_name,address_line1,postal_code
200000277,北京市,北京市,丰台区,北京市北京市丰台区高新南七道672号,777433
200000278,浙江省,杭州市,西湖区,浙江省杭州市西湖区星湖街729号,661320
200000279,浙江省,杭州市,西湖区,浙江省杭州市西湖区张江路125号,126135
200000280,广东省,深圳市,福田区,广东省深圳市福田区科技南一道412号,747518
200000281,上海市,上海市,徐汇区,上海市上海市徐汇区科技南一道931号,799155
200000282,北京市,北京市,丰台区,北京市北京市丰台区人民路143号,976097
200000283,上海市,上海市,浦东新区,上海市上海市浦东新区建国路191号,972712
200000284,浙江省,杭州市,余杭区,浙江省杭州市余杭区文一西路784号,390683
200000285,浙江省,杭州市,滨江区,浙江省杭州市滨江区星湖街55号,385915
200000286,上海市,上海市,闵行区,上海市上海市闵行区星湖街14号,243601
200000287,广东省,深圳市,南山区,广东省深圳市南山区星湖街946号,118223
200000288,广东省,深圳市,福田区,广东省深圳市福田区文一西路80号,119719
200000289,浙江省,杭州市,余杭区,浙江省杭州市余杭区高新南七道30号,195189
200000290,广东省,深圳市,南山区,广东省深圳市南山区创新大道376号,832045
200000291,广东省,深圳市,福田区,广东省深圳市福田区张江路468号,729554
200000292,广东省,深圳市,南山区,广东省深圳市南山区星湖街405号,520085
200000293,北京市,北京市,丰台区,北京市北京市丰台区张江路151号,905305
200000294,上海市,上海市,浦东新区,上海市上海市浦东新区文一西路677号,888119
200000295,北京市,北京市,海淀区,北京市北京市海淀区科技南一道34号,285460
200000296,上海市,上海市,浦东新区,上海市上海市浦东新区人民路270号,618721
200000297,江苏省,苏州市,虎丘区,江苏省苏州市虎丘区高新南七道58号,793360
200000298,江苏省,苏州市,虎丘区,江苏省苏州市虎丘区人民路331号,700350
200000299,江苏省,苏州市,吴中区,江苏省苏州市吴中区人民路824号,336858
200000300,江苏省,苏州市,吴中区,江苏省苏州市吴中区创新大道688号,900527
200000301,浙江省,杭州市,余杭区,浙江省杭州市余杭区张江路865号,556538
200000302,北京市,北京市,海淀区,北京市北京市海淀区科技南一道207号,267099
200000303,浙江省,杭州市,余杭区,浙江省杭州市余杭区文一西路585号,870158
200000304,江苏省,苏州市,虎丘区,江苏省苏州市虎丘区人民路261号,718115
200000305,浙江省,杭州市,滨江区,浙江省杭州市滨江区人民路317号,769986
200000306,江苏省,苏州市,吴中区,江苏省苏州市吴中区人民路809号,135527
200000307,浙江省,杭州市,余杭区,浙江省杭州市余杭区人民路205号,758816
200000308,江苏省,苏州市,工业园区,江苏省苏州市工业园区文一西路425号,485456
200000309,浙江省,杭州市,西湖区,浙江省杭州市西湖区文一西路15号,853489
200000310,浙江省,杭州市,余杭区,浙江省杭州市余杭区张江路269号,346924
200000311,江苏省,苏州市,工业园区,江苏省苏州市工业园区创新大道931号,471512
200000312,北京市,北京市,朝阳区,北京市北京市朝阳区文一西路325号,844756
200000313,江苏省,苏州市,吴中区,江苏省苏州市吴中区创新大道783号,258612
200000314,上海市,上海市,闵行区,上海市上海市闵行区创新大道505号,217955
200000315,浙江省,杭州市,滨江区,浙江省杭州市滨江区文一西路909号,444622
200000316,上海市,上海市,闵行区,上海市上海市闵行区高新南七道971号,867080
200000317,北京市,北京市,海淀区,北京市北京市海淀区星湖街124号,413048
200000318,北京市,北京市,朝阳区,北京市北京市朝阳区科技南一道526号,458345
200000319,上海市,上海市,浦东新区,上海市上海市浦东新区文一西路940号,147285
200000320,北京市,北京市,丰台区,北京市北京市丰台区张江路322号,715732
200000321,北京市,北京市,海淀区,北京市北京市海淀区人民路890号,789666
200000322,上海市,上海市,浦东新区,上海市上海市浦东新区文一西路309号,907111
200000323,北京市,北京市,海淀区,北京市北京市海淀区创新大道755号,706770
200000324,北京市,北京市,海淀区,北京市北京市海淀区文一西路507号,752944
200000325,江苏省,苏州市,虎丘区,江苏省苏州市虎丘区星湖街637号,317273
200000326,浙江省,杭州市,余杭区,浙江省杭州市余杭区科技南一道827号,166758
200000327,广东省,深圳市,南山区,广东省深圳市南山区文一西路844号,689795
200000328,北京市,北京市,朝阳区,北京市北京市朝阳区建国路855号,948450
200000329,上海市,上海市,徐汇区,上海市上海市徐汇区高新南七道967号,131208
200000330,上海市,上海市,闵行区,上海市上海市闵行区高新南七道932号,460875
200000331,浙江省,杭州市,西湖区,浙江省杭州市西湖区张江路219号,197328
200000332,广东省,深圳市,福田区,广东省深圳市福田区张江路587号,872652
200000333,北京市,北京市,海淀区,北京市北京市海淀区文一西路95号,165214
200000334,北京市,北京市,丰台区,北京市北京市丰台区创新大道133号,838747
200000335,江苏省,苏州市,虎丘区,江苏省苏州市虎丘区张江路498号,129336
200000336,江苏省,苏州市,虎丘区,江苏省苏州市虎丘区创新大道855号,855009
200000337,广东省,深圳市,南山区,广东省深圳市南山区科技南一道586号,760717
200000338,浙江省,杭州市,余杭区,浙江省杭州市余杭区创新大道87号,946118
200000339,江苏省,苏州市,工业园区,江苏省苏州市工业园区星湖街315号,527060
200000340,上海市,上海市,闵行区,上海市上海市闵行区文一西路276号,163577
200000341,上海市,上海市,浦东新区,上海市上海市浦东新区星湖街383号,666692
200000342,上海市,上海市,闵行区,上海市上海市闵行区科技南一道166号,875089
200000343,江苏省,苏州市,虎丘区,江苏省苏州市虎丘区建国路471号,728635
200000344,江苏省,苏州市,虎丘区,江苏省苏州市虎丘区星湖街860号,905270
200000345,北京市,北京市,丰台区,北京市北京市丰台区建国路8号,305611
200000346,江苏省,苏州市,工业园区,江苏省苏州市工业园区科技南一道994号,826648
200000347,广东省,深圳市,宝安区,广东省深圳市宝安区建国路49号,391433
200000348,广东省,深圳市,南山区,广东省深圳市南山区创新大道443号,947311
200000349,广东省,深圳市,福田区,广东省深圳市福田区高新南七道912号,988869
200000350,上海市,上海市,浦东新区,上海市上海市浦东新区创新大道394号,586758
200000351,上海市,上海市,闵行区,上海市上海市闵行区高新南七道432号,604783
200000352,广东省,深圳市,宝安区,广东省深圳市宝安区星湖街59号,348918
200000353,江苏省,苏州市,工业园区,江苏省苏州市工业园区文一西路466号,927527
200000354,上海市,上海市,浦东新区,上海市上海市浦东新区星湖街298号,561801
200000355,江苏省,苏州市,工业园区,江苏省苏州市工业园区科技南一道852号,810360
200000356,浙江省,杭州市,西湖区,浙江省杭州市西湖区人民路712号,492435
200000357,北京市,北京市,丰台区,北京市北京市丰台区文一西路172号,633320
200000358,北京市,北京市,朝阳区,北京市北京市朝阳区人民路224号,420863
200000359,北京市,北京市,海淀区,北京市北京市海淀区张江路392号,125918
200000360,江苏省,苏州市,虎丘区,江苏省苏州市虎丘区张江路764号,955181
200000361,浙江省,杭州市,滨江区,浙江省杭州市滨江区建国路529号,715517
200000362,广东省,深圳市,福田区,广东省深圳市福田区高新南七道348号,336444
200000363,北京市,北京市,朝阳区,北京市北京市朝阳区人民路193号,597840
200000364,上海市,上海市,浦东新区,上海市上海市浦东新区创新大道59号,486559
200000365,上海市,上海市,闵行区,上海市上海市闵行区建国路515号,851589
200000366,北京市,北京市,海淀区,北京市北京市海淀区张江路401号,742805
200000367,浙江省,杭州市,滨江区,浙江省杭州市滨江区人民路781号,679677
200000368,广东省,深圳市,宝安区,广东省深圳市宝安区星湖街335号,802855
200000369,浙江省,杭州市,余杭区,浙江省杭州市余杭区科技南一道694号,386525
200000370,浙江省,杭州市,余杭区,浙江省杭州市余杭区文一西路17号,542166
200000371,北京市,北京市,朝阳区,北京市北京市朝阳区建国路219号,211028
200000372,上海市,上海市,浦东新区,上海市上海市浦东新区张江路983号,199346
200000373,广东省,深圳市,福田区,广东省深圳市福田区建国路756号,549312
200000374,广东省,深圳市,宝安区,广东省深圳市宝安区人民路664号,952188
200000375,广东省,深圳市,南山区,广东省深圳市南山区创新大道72号,301814
200000376,江苏省,苏州市,吴中区,江苏省苏州市吴中区创新大道991号,766478
200000377,江苏省,苏州市,吴中区,江苏省苏州市吴中区星湖街567号,861945
200000378,江苏省,苏州市,虎丘区,江苏省苏州市虎丘区创新大道316号,772188
200000379,浙江省,杭州市,余杭区,浙江省杭州市余杭区创新大道36号,952624
200000380,广东省,深圳市,宝安区,广东省深圳市宝安区建国路898号,543489
200000381,北京市,北京市,朝阳区,北京市北京市朝阳区文一西路72号,911329
200000382,浙江省,杭州市,滨江区,浙江省杭州市滨江区人民路452号,757286
200000383,广东省,深圳市,南山区,广东省深圳市南山区建国路535号,930248
200000384,江苏省,苏州市,虎丘区,江苏省苏州市虎丘区文一西路4号,579114
200000385,江苏省,苏州市,吴中区,江苏省苏州市吴中区创新大道240号,736237
200000386,江苏省,苏州市,吴中区,江苏省苏州市吴中区创新大道173号,567965
200000387,上海市,上海市,徐汇区,上海市上海市徐汇区创新大道93号,934184
200000388,上海市,上海市,浦东新区,上海市上海市浦东新区文一西路587号,485600
200000389,上海市,上海市,闵行区,上海市上海市闵行区高新南七道149号,955793
200000390,北京市,北京市,朝阳区,北京市北京市朝阳区高新南七道157号,968100
200000391,江苏省,苏州市,虎丘区,江苏省苏州市虎丘区建国路718号,997845
200000392,浙江省,杭州市,滨江区,浙江省杭州市滨江区人民路696号,982544
200000393,北京市,北京市,丰台区,北京市北京市丰台区文一西路797号,586197
200000394,北京市,北京市,海淀区,北京市北京市海淀区星湖街102号,441027
200000395,广东省,深圳市,南山区,广东省深圳市南山区星湖街6号,681667
200000396,上海市,上海市,闵行区,上海市上海市闵行区创新大道144号,705103
200000397,上海市,上海市,闵行区,上海市上海市闵行区文一西路564号,367352
200000398,江苏省,苏州市,虎丘区,江苏省苏州市虎丘区人民路27号,732928
200000399,广东省,深圳市,南山区,广东省深圳市南山区张江路603号,961240
200000400,上海市,上海市,徐汇区,上海市上海市徐汇区星湖街674号,232506
200000401,广东省,深圳市,福田区,广东省深圳市福田区人民路790号,427928
200000402,上海市,上海市,徐汇区,上海市上海市徐汇区文一西路416号,114575
200000403,浙江省,杭州市,西湖区,浙江省杭州市西湖区高新南七道976号,153379
200000404,上海市,上海市,浦东新区,上海市上海市浦东新区创新大道914号,747756
200000405,北京市,北京市,朝阳区,北京市北京市朝阳区星湖街788号,788530
200000406,浙江省,杭州市,余杭区,浙江省杭州市余杭区建国路292号,142211
200000407,广东省,深圳市,南山区,广东省深圳市南山区星湖街160号,460836
200000408,广东省,深圳市,福田区,广东省深圳市福田区建国路683号,960471
200000409,北京市,北京市,海淀区,北京市北京市海淀区张江路717号,764073
200000410,江苏省,苏州市,工业园区,江苏省苏州市工业园区张江路484号,393768
200000411,浙江省,杭州市,西湖区,浙江省杭州市西湖区人民路90号,211532
200000412,北京市,北京市,丰台区,北京市北京市丰台区张江路913号,896241
200000413,浙江省,杭州市,西湖区,浙江省杭州市西湖区人民路507号,817953
200000414,江苏省,苏州市,吴中区,江苏省苏州市吴中区张江路566号,224888
200000415,上海市,上海市,闵行区,上海市上海市闵行区星湖街419号,741185
200000416,江苏省,苏州市,工业园区,江苏省苏州市工业园区人民路160号,567723
200000417,上海市,上海市,浦东新区,上海市上海市浦东新区文一西路147号,175548
200000418,上海市,上海市,浦东新区,上海市上海市浦东新区科技南一道981号,930116
200000419,广东省,深圳市,宝安区,广东省深圳市宝安区张江路106号,636391
200000420,上海市,上海市,闵行区,上海市上海市闵行区文一西路370号,188923
200000421,浙江省,杭州市,滨江区,浙江省杭州市滨江区星湖街400号,568394
200000422,浙江省,杭州市,滨江区,浙江省杭州市滨江区人民路563号,621249
200000423,广东省,深圳市,福田区,广东省深圳市福田区高新南七道870号,990586
200000424,广东省,深圳市,福田区,广东省深圳市福田区星湖街31号,254021
200000425,广东省,深圳市,宝安区,广东省深圳市宝安区星湖街516号,268137
200000426,北京市,北京市,朝阳区,北京市北京市朝阳区文一西路837号,826061
200000427,上海市,上海市,浦东新区,上海市上海市浦东新区张江路193号,678490
200000428,江苏省,苏州市,虎丘区,江苏省苏州市虎丘区高新南七道998号,235808
200000429,浙江省,杭州市,西湖区,浙江省杭州市西湖区高新南七道459号,923501
200000430,江苏省,苏州市,吴中区,江苏省苏州市吴中区文一西路511号,198685
200000431,江苏省,苏州市,虎丘区,江苏省苏州市虎丘区人民路419号,998630
200000432,浙江省,杭州市,西湖区,浙江省杭州市西湖区人民路875号,176523
200000433,江苏省,苏州市,虎丘区,江苏省苏州市虎丘区创新大道218号,836405
200000434,广东省,深圳市,宝安区,广东省深圳市宝安区人民路277号,364315
200000435,江苏省,苏州市,虎丘区,江苏省苏州市虎丘区创新大道487号,661519
200000436,北京市,北京市,海淀区,北京市北京市海淀区科技南一道462号,972950
200000437,江苏省,苏州市,吴中区,江苏省苏州市吴中区文一西路717号,623376
200000438,上海市,上海市,浦东新区,上海市上海市浦东新区文一西路826号,977904
200000439,浙江省,杭州市,滨江区,浙江省杭州市滨江区文一西路360号,932308
200000440,江苏省,苏州市,吴中区,江苏省苏州市吴中区高新南七道344号,278688
200000441,上海市,上海市,闵行区,上海市上海市闵行区张江路858号,679763
200000442,浙江省,杭州市,余杭区,浙江省杭州市余杭区建国路305号,303244
200000443,浙江省,杭州市,余杭区,浙江省杭州市余杭区文一西路507号,985652
200000444,上海市,上海市,浦东新区,上海市上海市浦东新区文一西路352号,463629
200000445,广东省,深圳市,宝安区,广东省深圳市宝安区星湖街275号,386960
200000446,上海市,上海市,闵行区,上海市上海市闵行区星湖街814号,315830
200000447,上海市,上海市,徐汇区,上海市上海市徐汇区高新南七道408号,131394
200000448,北京市,北京市,海淀区,北京市北京市海淀区建国路540号,328026
200000449,江苏省,苏州市,吴中区,江苏省苏州市吴中区人民路243号,704413
200000450,北京市,北京市,朝阳区,北京市北京市朝阳区高新南七道506号,742064
200000451,广东省,深圳市,福田区,广东省深圳市福田区科技南一道114号,150335
200000452,上海市,上海市,闵行区,上海市上海市闵行区创新大道288号,437548
200000453,浙江省,杭州市,滨江区,浙江省杭州市滨江区人民路193号,611333
200000454,江苏省,苏州市,虎丘区,江苏省苏州市虎丘区星湖街703号,422066
200000455,浙江省,杭州市,滨江区,浙江省杭州市滨江区人民路521号,449951
200000456,浙江省,杭州市,余杭区,浙江省杭州市余杭区科技南一道917号,137421
200000457,江苏省,苏州市,吴中区,江苏省苏州市吴中区科技南一道97号,294069
200000458,广东省,深圳市,南山区,广东省深圳市南山区科技南一道609号,469249
200000459,江苏省,苏州市,吴中区,江苏省苏州市吴中区创新大道260号,481985
200000460,北京市,北京市,海淀区,北京市北京市海淀区建国路763号,193610
200000461,北京市,北京市,丰台区,北京市北京市丰台区高新南七道296号,215543
200000462,北京市,北京市,海淀区,北京市北京市海淀区科技南一道441号,469366
200000463,江苏省,苏州市,工业园区,江苏省苏州市工业园区人民路433号,518500
200000464,北京市,北京市,丰台区,北京市北京市丰台区星湖街385号,920411
200000465,江苏省,苏州市,工业园区,江苏省苏州市工业园区高新南七道131号,751050
200000466,江苏省,苏州市,工业园区,江苏省苏州市工业园区文一西路759号,713015
200000467,上海市,上海市,浦东新区,上海市上海市浦东新区文一西路254号,314217
200000468,广东省,深圳市,南山区,广东省深圳市南山区星湖街839号,880768
200000469,江苏省,苏州市,虎丘区,江苏省苏州市虎丘区文一西路578号,508346
200000470,广东省,深圳市,南山区,广东省深圳市南山区星湖街361号,787796
200000471,上海市,上海市,徐汇区,上海市上海市徐汇区高新南七道599号,747469
200000472,江苏省,苏州市,工业园区,江苏省苏州市工业园区科技南一道868号,886363
200000473,上海市,上海市,浦东新区,上海市上海市浦东新区文一西路597号,125420
200000474,上海市,上海市,徐汇区,上海市上海市徐汇区星湖街821号,170416
200000475,浙江省,杭州市,滨江区,浙江省杭州市滨江区文一西路548号,703304
200000476,江苏省,苏州市,吴中区,江苏省苏州市吴中区科技南一道242号,617530
200000477,江苏省,苏州市,虎丘区,江苏省苏州市虎丘区创新大道311号,919506
200000478,上海市,上海市,闵行区,上海市上海市闵行区高新南七道199号,459793
200000479,江苏省,苏州市,吴中区,江苏省苏州市吴中区建国路300号,236017
200000480,江苏省,苏州市,虎丘区,江苏省苏州市虎丘区文一西路56号,463473
200000481,广东省,深圳市,南山区,广东省深圳市南山区创新大道857号,135395
200000482,江苏省,苏州市,工业园区,江苏省苏州市工业园区高新南七道945号,968386
200000483,上海市,上海市,闵行区,上海市上海市闵行区星湖街984号,499812
200000484,江苏省,苏州市,吴中区,江苏省苏州市吴中区高新南七道857号,377366
200000485,江苏省,苏州市,虎丘区,江苏省苏州市虎丘区张江路890号,618970
200000486,广东省,深圳市,宝安区,广东省深圳市宝安区建国路359号,214466
200000487,江苏省,苏州市,虎丘区,江苏省苏州市虎丘区张江路637号,132670
200000488,广东省,深圳市,南山区,广东省深圳市南山区人民路552号,868654
200000489,北京市,北京市,海淀区,北京市北京市海淀区文一西路361号,687681
200000490,广东省,深圳市,南山区,广东省深圳市南山区人民路432号,629558
200000491,浙江省,杭州市,西湖区,浙江省杭州市西湖区人民路926号,542875
200000492,浙江省,杭州市,西湖区,浙江省杭州市西湖区星湖街742号,903162
200000493,江苏省,苏州市,工业园区,江苏省苏州市工业园区星湖街43号,953527
200000494,浙江省,杭州市,余杭区,浙江省杭州市余杭区建国路566号,979535
200000495,北京市,北京市,海淀区,北京市北京市海淀区文一西路886号,243464
200000496,上海市,上海市,闵行区,上海市上海市闵行区建国路862号,685283
200000497,浙江省,杭州市,余杭区,浙江省杭州市余杭区人民路69号,614526
200000498,北京市,北京市,丰台区,北京市北京市丰台区高新南七道557号,604322
200000499,浙江省,杭州市,余杭区,浙江省杭州市余杭区张江路275号,632139
200000500,浙江省,杭州市,西湖区,浙江省杭州市西湖区星湖街549号,316217
200000501,上海市,上海市,浦东新区,上海市上海市浦东新区星湖街859号,661720
200000502,广东省,深圳市,南山区,广东省深圳市南山区建国路35号,385693
200000503,浙江省,杭州市,西湖区,浙江省杭州市西湖区张江路804号,439452
200000504,北京市,北京市,丰台区,北京市北京市丰台区人民路975号,490843
200000505,北京市,北京市,丰台区,北京市北京市丰台区建国路86号,248195
200000506,上海市,上海市,闵行区,上海市上海市闵行区高新南七道983号,783680
200000507,上海市,上海市,闵行区,上海市上海市闵行区星湖街767号,673660
200000508,北京市,北京市,海淀区,北京市北京市海淀区建国路959号,446215
200000509,上海市,上海市,闵行区,上海市上海市闵行区星湖街69号,467476
200000510,江苏省,苏州市,工业园区,江苏省苏州市工业园区张江路578号,207292
200000511,浙江省,杭州市,滨江区,浙江省杭州市滨江区科技南一道332号,181566
200000512,浙江省,杭州市,西湖区,浙江省杭州市西湖区张江路729号,249824
200000513,广东省,深圳市,南山区,广东省深圳市南山区创新大道370号,651553
200000514,广东省,深圳市,宝安区,广东省深圳市宝安区创新大道623号,762951
200000515,上海市,上海市,闵行区,上海市上海市闵行区建国路671号,743829
200000516,广东省,深圳市,福田区,广东省深圳市福田区建国路706号,630019
200000517,广东省,深圳市,南山区,广东省深圳市南山区科技南一道223号,768934
200000518,浙江省,杭州市,滨江区,浙江省杭州市滨江区建国路182号,409258
200000519,江苏省,苏州市,工业园区,江苏省苏州市工业园区高新南七道717号,628236
200000520,江苏省,苏州市,吴中区,江苏省苏州市吴中区文一西路645号,476317
200000521,浙江省,杭州市,滨江区,浙江省杭州市滨江区高新南七道616号,454291
200000522,广东省,深圳市,南山区,广东省深圳市南山区张江路812号,903023
200000523,江苏省,苏州市,工业园区,江苏省苏州市工业园区创新大道564号,820147
200000524,北京市,北京市,丰台区,北京市北京市丰台区科技南一道228号,738081
200000525,北京市,北京市,朝阳区,北京市北京市朝阳区张江路982号,542223
200000526,北京市,北京市,海淀区,北京市北京市海淀区科技南一道311号,545625
200000527,上海市,上海市,闵行区,上海市上海市闵行区建国路528号,952319
200000528,北京市,北京市,朝阳区,北京市北京市朝阳区创新大道333号,412143
200000529,广东省,深圳市,南山区,广东省深圳市南山区高新南七道382号,140147
200000530,江苏省,苏州市,吴中区,江苏省苏州市吴中区建国路711号,937764
200000531,江苏省,苏州市,虎丘区,江苏省苏州市虎丘区创新大道614号,928645
200000532,江苏省,苏州市,虎丘区,江苏省苏州市虎丘区星湖街474号,995857
200000533,北京市,北京市,丰台区,北京市北京市丰台区创新大道31号,263473
200000534,广东省,深圳市,宝安区,广东省深圳市宝安区张江路183号,266846
200000535,北京市,北京市,海淀区,北京市北京市海淀区创新大道161号,286255
200000536,北京市,北京市,朝阳区,北京市北京市朝阳区高新南七道625号,362081
200000537,江苏省,苏州市,工业园区,江苏省苏州市工业园区科技南一道212号,705659
200000538,北京市,北京市,海淀区,北京市北京市海淀区文一西路802号,537350
200000539,江苏省,苏州市,吴中区,江苏省苏州市吴中区文一西路740号,277160
200000540,江苏省,苏州市,吴中区,江苏省苏州市吴中区张江路609号,137480
200000541,江苏省,苏州市,虎丘区,江苏省苏州市虎丘区张江路653号,338989
200000542,北京市,北京市,丰台区,北京市北京市丰台区星湖街892号,650750
200000543,广东省,深圳市,宝安区,广东省深圳市宝安区建国路760号,312368
200000544,浙江省,杭州市,西湖区,浙江省杭州市西湖区建国路234号,823137
200000545,广东省,深圳市,福田区,广东省深圳市福田区文一西路202号,601532
200000546,北京市,北京市,丰台区,北京市北京市丰台区张江路505号,761785
200000547,上海市,上海市,闵行区,上海市上海市闵行区创新大道168号,287480
200000548,浙江省,杭州市,西湖区,浙江省杭州市西湖区星湖街332号,263984
200000549,北京市,北京市,丰台区,北京市北京市丰台区人民路781号,537385
200000550,上海市,上海市,徐汇区,上海市上海市徐汇区建国路817号,325422
200000551,上海市,上海市,闵行区,上海市上海市闵行区科技南一道104号,158840
200000552,上海市,上海市,徐汇区,上海市上海市徐汇区张江路571号,656822
